MCQ,Choices,Correct
What is the scientific study of life called?,a: Chemistry | b: Biology | c: Physics | d: Geology,b
Which theme in biology explains the unity and diversity of life?,a: Evolution | b: Photosynthesis | c: Mitosis | d: Respiration,a
"What is the process that allows organisms to move, grow, and reproduce?",a: Photosynthesis | b: Evolution | c: Energy processing | d: Cell division,c
What is the main unit of organization in biology?,a: Tissue | b: Organ | c: Cell | d: Organism,c
When did life on Earth emerge?,"a: 1 million years ago | b: 3.7 billion years ago | c: 500 million years ago | d: 10,000 years ago",b
